Description,ExternalId,Family,Id,IsActive,Name,ProductCode,QuantityUnitOfMeasure,SBQQ__AssetAmendmentBehavior__c,SBQQ__AssetConversion__c,SBQQ__BatchQuantity__c,SBQQ__BillingFrequency__c,SBQQ__BillingType__c,SBQQ__BlockPricingField__c,SBQQ__ChargeType__c,SBQQ__Component__c,SBQQ__CompoundDiscountRate__c,SBQQ__ConfigurationEvent__c,SBQQ__ConfigurationFieldSet__c,SBQQ__ConfigurationFields__c,SBQQ__ConfigurationFormTitle__c,SBQQ__ConfigurationType__c,SBQQ__ConfigurationValidator__c,SBQQ__ConfiguredCodePattern__c,SBQQ__ConfiguredDescriptionPattern__c,SBQQ__CostEditable__c,SBQQ__CustomConfigurationPage__c,SBQQ__CustomConfigurationRequired__c,SBQQ__CustomerCommunityAvailability__c,SBQQ__DefaultPricingTable__c,SBQQ__DefaultQuantity__c,SBQQ__DescriptionLocked__c,SBQQ__DynamicPricingConstraint__c,SBQQ__EnableLargeConfiguration__c,SBQQ__ExcludeFromMaintenance__c,SBQQ__ExcludeFromOpportunity__c,SBQQ__ExternallyConfigurable__c,SBQQ__GenerateContractedPrice__c,SBQQ__HasConfigurationAttributes__c,SBQQ__HasConsumptionSchedule__c,SBQQ__Hidden__c,SBQQ__HidePriceInSearchResults__c,SBQQ__IncludeInMaintenance__c,SBQQ__NewQuoteGroup__c,SBQQ__NonDiscountable__c,SBQQ__NonPartnerDiscountable__c,SBQQ__OptionLayout__c,SBQQ__OptionSelectionMethod__c,SBQQ__Optional__c,SBQQ__PriceEditable__c,SBQQ__PricingMethodEditable__c,SBQQ__PricingMethod__c,SBQQ__ProductPictureID__c,SBQQ__QuantityEditable__c,SBQQ__QuantityScale__c,SBQQ__ReconfigurationDisabled__c,SBQQ__RenewalProduct__c,SBQQ__SortOrder__c,SBQQ__Specifications__c,SBQQ__SubscriptionBase__c,SBQQ__SubscriptionCategory__c,SBQQ__SubscriptionPercent__c,SBQQ__SubscriptionPricing__c,SBQQ__SubscriptionTarget__c,SBQQ__SubscriptionTerm__c,SBQQ__SubscriptionType__c,SBQQ__TaxCode__c,SBQQ__Taxable__c,SBQQ__TermDiscountLevel__c,SBQQ__UpgradeCredit__c,SBQQ__UpgradeRatio__c,SBQQ__UpgradeSource__c,SBQQ__UpgradeTarget__c,StockKeepingUnit
,,,5d265c7c-02c0-49ab-b095-9177776d9098,true,Everything Plan,PLAN-000,,Default,One per quote line,,,,Quantity,,false,,,,,,,,,,false,,false,,,1.0,false,,false,false,false,false,,false,false,false,false,false,false,false,false,,Click,false,false,false,List,,true,,false,,,,List,,,Fixed Price,,12.0,Renewable,,false,,,,,,
Module that enables the export of your Time and Expense data to Access, Excel, and JDBC Databases.,,Software,78335201-3599-4e5b-93b6-64ad7aaaf25b,true,Report Exporting Tools,S-TE-REPX,,,One per quote line,,Annual,Advance,Quantity,Recurring,false,,,,,,,,,,false,,false,,,1.0,false,,false,false,false,false,,false,false,false,false,false,false,false,false,,Click,false,false,false,List,,true,,false,,,,List,,,Fixed Price,,12.0,Renewable,,,,,,,,
Automatically Reimburse an Unlimited Number of Expense Reports from Credit Card, ACH, or Wire Sources to ACH Accounts.,,Software,38d78ed2-d2b7-4516-8daf-e500ae4e112e,true,Expense Reimbursement Unlimited,S-TE-PAYU,,,One per quote line,,Annual,Advance,Quantity,Recurring,false,,,,,,,,,,false,,false,,,1.0,false,,false,false,false,false,,false,false,false,false,false,false,true,false,,Click,false,false,false,List,,true,,false,,,,List,,,Fixed Price,,12.0,Renewable,,,,,,,,
This module allows users to reduce billing errors and eliminate inefficiencies with accurate time tracking.,,Software,e4973090-e6ee-4cde-ad5d-275f34193171,true,Billing Hours Tracking,S-TE-BILL,,,One per quote line,,Annual,Advance,Quantity,Recurring,false,,,,,,,,,,false,,false,,,1.0,false,,false,false,false,false,,false,false,false,false,false,false,false,false,,Click,false,false,false,List,,true,,false,,,,List,,,Fixed Price,,12.0,Renewable,,true,,,,,,
Online Admin Training for the Time & Expense Suite,,Services,dbc40d82-5456-45cb-a796-f263e378cb67,true,T&E Admin Training,S-TE-ADTR,,Allow Refund,One per quote line,,,,Quantity,One-Time,false,,,,,,,,,,false,,false,,,1.0,false,,false,false,false,false,,false,false,false,false,false,false,true,false,,Click,false,false,false,List,,true,,false,,,,List,,,,,,Renewable,,false,,,,,,
Custom Implementation managed by in-house professional services, charged on a Time and Material basis.,,Services,7c2a9652-186f-462a-98b1-41727b08dabd,true,Professional Services Project,SV-PRJ,,Allow Refund,,,,,Quantity,One-Time,false,,Always,,,,Required,,,,false,,false,,,1.0,false,,false,false,false,false,,true,false,true,false,false,false,true,false,,Click,false,false,false,List,,true,,,,,,List,,,,,,Renewable,,false,,,,,,
The Program Director provides executive leadership, subject matter expertise, and program oversight.,,Services,6751fce5-ce12-4561-9cca-dcc6f3539965,true,Program Director,SV-PD,,Allow Refund,,,,,Quantity,One-Time,true,,,,,,,,,,false,,false,,,1.0,false,,false,false,false,false,,false,false,false,false,false,false,true,false,,Click,false,false,false,List,,true,,false,,,,List,,,,,,Renewable,,,,,,,,
The Project Manager ensures a project's timely and efficient delivery by coordinating meetings, tracking progress, escalating issues, and proctoring weekly status reports.,,Services,f6a8c37b-4f10-49b4-8f9e-d8e8ae8fd42b,true,Project Manager,SV-PMN,,Allow Refund,,,,,Quantity,One-Time,true,,,,,,,,,,false,,false,,,1.0,false,,false,false,false,false,,false,false,false,false,false,false,true,false,,Click,false,false,false,List,,,,false,,,,List,,,,,,Renewable,,true,,,,,,
Our Solution Architects are responsible for analyzing customer requirements and designing the optimal solution capabilities.,,Services,3c6d5fd7-1354-471c-b3e2-05f0d1076701,true,Solutions Architect,SV-SAT,,Allow Refund,,,,,Quantity,One-Time,true,,,,,,,,,,false,,false,,,1.0,false,,false,false,false,false,,false,false,false,false,false,false,true,false,,Click,false,false,false,List,,true,,false,,,,List,,,,,,Renewable,,true,,,,,,
Our certified Implementation Engineers bring a wealth of application expertise and integration experience to ensure the client's other systems are connected.,,Services,b51d6451-a61e-436d-86e3-cadfae55cd31,true,Implementation Engineer,SV-IMP,,Allow Refund,,,,,Quantity,One-Time,true,,,,,,,,,,false,,false,,,1.0,false,,false,false,false,false,,false,false,false,false,false,false,true,false,,Click,false,false,false,List,,true,,false,,,,List,,,,,,Renewable,,true,,,,,,
Overage Rate per additional Expense Reports,,Software,56b3e6c3-fec6-4292-8b61-682037e59861,true,Additional Expense Report Reimbursement,S-TE-ADDR,,Allow Refund,One per quote line,,Monthly,,Quantity,Usage,true,,,,,,,,,,false,,false,,,1.0,false,,false,false,false,false,,false,false,false,false,false,false,true,false,,Click,false,true,false,List,,false,,false,,,,List,,,,,,Renewable,,false,,,,,,
Consulting implementation package managed by in-house professional services. Rate is a blended rate with both time and materials.,,Services,f6eaad44-b60a-48f9-b0e7-362fc28daf89,true,Professional Services Hours (Blended Rate),SV-PSH,,Allow Refund,,,,,Quantity,One-Time,false,,,,,,,,,,false,,false,,,1.0,false,,false,false,false,false,,false,false,false,false,false,false,true,false,,Click,false,false,false,List,,true,,false,,,,List,,,,,,Renewable,,false,,,,,,
Data Normalization Experts engage early in the project and assist customers in normalizing, cleaning, and de-duping data, and can perform upload and update functions.,,Services,b7369fd1-99e5-4851-ad68-df73e74d8bb9,true,Data Normalization Expert,SV-DNE,,Allow Refund,,,,,Quantity,One-Time,true,,,,,,,,,,false,,false,,,1.0,false,,false,false,false,false,,false,false,false,false,false,false,true,false,,Click,false,false,false,List,,,,false,,,,List,,,,,,Renewable,,true,,,,,,
Quality Assurance Engineers test and support the activities prior to a successful Go-Live launch.,,Services,e5f2cafd-f8ce-4d5b-8cb7-fd68a2f45c46,true,Quality Assurance Engineer,SV-QAE,,Allow Refund,,,,,Quantity,One-Time,true,,,,,,,,,,false,,false,,,1.0,false,,false,false,false,false,,false,false,false,false,false,false,true,false,,Click,false,false,false,List,,true,,false,,,,List,,,,,,Renewable,,true,,,,,,
Perpetual license for one (1) Time and Expense Administrator.,,Software,91504314-e080-41f0-a46d-034205ed96c0,true,TE Suite Perpetual Admin License,S-TE-ADM,,Allow Refund,One per quote line,,,,Quantity,One-Time,false,,,,,,,,,,false,,false,,,1.0,false,,false,false,false,false,,false,false,false,false,true,false,false,false,,Click,false,false,false,List,,true,,false,,,,List,Software,,,,,Renewable,,false,,,,,,
Our certified Integration Specialist Engineers bring a wealth of application expertise and integration experience to ensure the client's other systems are connected.,,Services,9e18559b-939d-466f-b9ff-a027f6259ae6,true,Integration Specialist Engineer,SV-ISE,,Allow Refund,,,,,Quantity,One-Time,true,,,,,,,,,,false,,false,,,1.0,false,,false,false,false,false,,false,false,false,false,false,false,true,false,,Click,false,false,false,List,,true,,false,,,,List,,,,,,Renewable,,false,,,,,,
Time and Expense Perpetual Suite,,Bundle,5bd9f95c-3851-44ef-9df2-4f9e6c8336db,true,Time and Expense Perpetual Suite,S-TE-PER,,Allow Refund,One per quote line,,,,Quantity,One-Time,false,,Always,,,,Required,,,,false,,false,,,1.0,false,,false,false,false,false,,true,false,true,true,false,false,true,false,Sections,Click,false,false,false,List,,true,,false,,,,List,,,,,,Renewable,,false,,,,,,
Perpetual license for one (1) Time and Expense user.,,Software,771484fe-9268-4c8b-bbd2-2e1d948fd39b,true,TE Suite Perpetual Time and Expense License,S-TE-TEPL,,Allow Refund,One per quote line,,,,Quantity,One-Time,false,,,,,,,,,,false,,false,,,1.0,false,,false,false,false,false,,false,false,false,false,true,false,false,false,,Click,false,false,false,List,,true,,false,,,,List,Software,,,,,Renewable,,false,,,,,,
HP ProLiant rack and tower servers are industry's trusted multi-workload optimized servers, built to meet the business needs of today and tomorrow.,,Hardware,fb6f4995-9b38-4a5f-97a9-77fef547bb54,true,HP Proliant Server,H-SVR-HP,,Allow Refund,One per quote line,,,,Quantity,One-Time,false,,Always,,,,Required,,,,false,,false,,,1.0,false,,false,false,false,false,,false,false,false,false,false,false,false,false,Sections,Click,false,false,true,List,,true,,,,,,List,,,,,,Renewable,,false,,,,,,
Designed for software defined infrastructure supercharged for efficiency, performance, and agile services delivery across cloud-native and traditional applications.,,Hardware,2b96e103-d1ef-4456-a11d-469763fccc22,true,Intel Xeon E5-2667 v4 3.2GHz,25M Cache,9.60GT/s 8C/16T (135W),INTEL E5-2667,,Allow Refund,One per quote line,,,,Quantity,One-Time,true,,,,,,Disabled,,,,false,,false,,,1.0,false,,false,false,false,false,,false,false,false,false,true,false,false,false,Tabs,Click,false,false,false,List,,true,,false,,,,,Hardware,,,,,,,,,,,,,
Industry-leading rotational vibration tolerance design helps ensure consistent performance in dense multi-drive systems,,Hardware,bbed044d-4c9f-4493-832b-5b24e58cdb51,true,4TB 7.2k RPM NLSAS 12Gps 3.5 in,HD 4TB,,Allow Refund,One per quote line,,,,Quantity,One-Time,true,,,,,,Disabled,,,,false,,false,,,1.0,false,,false,false,false,false,,false,false,false,false,true,false,false,false,Tabs,Click,false,false,false,List,,true,,false,,,,List,Hardware,,,,,One-time,,false,,,,,,
Delivers superior performance with a theretical thoughtput of 80 Gb/s bidirectional thoughput.,,Hardware,074f33d9-5969-43b4-8cd2-f7ca9cca0b46,true,Intel X710 Dual Port 10Gb SFP,BET X710SFP,,Allow Refund,One per quote line,,,,Quantity,One-Time,true,,,,,,Disabled,,,,false,,false,,,1.0,false,,false,false,false,false,,false,false,false,false,true,false,false,false,Tabs,Click,false,false,false,List,,true,,false,,,,List,Hardware,,,,,One-time,,false,,,,,,
32GB RDIMM, 2133 MT/s, Low Volt, Dual Rank, x4 Data Width,,Hardware,9f57a197-7282-4530-b803-73647439671e,true,32GB RDIMM, 2133MT/s,MEM 32GB,,Allow Refund,One per quote line,,,,Quantity,One-Time,true,,,,,,Disabled,,,,false,,false,,,1.0,false,,false,false,false,false,,false,false,false,false,true,false,false,false,Tabs,Click,false,false,false,,,true,,false,,,,List,Hardware,,,,,One-time,,,,,,,,
Support and protect your IT equipment with rack enclosures designed for flexible deployments, usability and infrastructure scalability.,,Hardware,6d2236cf-6882-4ff3-a275-aeaa37b2ced5,true,Maxspace Rack Enclosure,MAXS-1014,,Allow Refund,One per quote line,,,,Quantity,One-Time,false,,Always,,,,Required,,,,false,,false,,,1.0,false,,false,false,false,false,,false,false,false,true,true,false,false,false,Tabs,Click,false,false,false,List,0151I000000zEOm,true,,,,,,List,Hardware,,,,,One-time,,false,,,,,,
Roof Fan Tray promotes bottom to top airflow for an enclosure in zero U of space. It cools by exhausting heat out of the roof of the rack.,,Hardware,ab95b71b-5921-485c-8073-e32853b95e17,true,Roof Fan Tray 750mm - 120V,BSSA-4306,,Allow Refund,One per quote line,,,,Quantity,One-Time,true,,,,,,Disabled,,,,false,,false,,,1.0,false,,false,false,false,false,,false,false,false,false,true,false,false,false,Tabs,Click,false,false,false,List,,true,,false,,,,List,Hardware,,,,,One-time,,false,,,,,,
MaxShell cooling, power distribution, and cable management products work seamlessly with IT enclosures to provide a complete infrastructure support system.  Holds 8 rack units (U's) for a vertical storage rack.,,Hardware,161f51aa-576d-4ebd-a64e-328163f827d8,true,MaxShell 8U 600mmx1070mm,BMX-1050,,Allow Refund,One per quote line,,,,Quantity,One-Time,true,,,,,,Disabled,,,,false,,false,,,1.0,false,,false,false,false,false,,false,false,false,false,true,false,false,false,Tabs,Click,false,false,false,List,,true,,false,,,,List,Hardware,,,,,One-time,,,,,,,,
The PowerSlide server is designed to bring excellent performance, expandability and deployment flexibility to organizations that must deploy multiple integrated servers in a minimum amount of space at a low cost.,,Hardware,9a8c29ad-282d-4e07-8ebc-b6088593fc81,true,PowerSlide R750 Rack Server,PS-R750,,Allow Refund,One per quote line,,,,Quantity,One-Time,false,,Always,,,,Allowed,,PS-R-{1}{2}{3}{4},,false,,false,,,1.0,false,,false,false,false,false,,true,false,false,false,true,false,false,false,Tabs,Click,false,false,false,List,,true,,,,,,List,Hardware,,,,,One-time,,false,,,,,,
16GB RDIMM, 2133MT/s, Dual Rank, x4 Data Width,,Hardware,4b825a2b-40d3-4877-8f8b-f14aa00a4cb4,true,16GB RDIMM, 2133MT/s,MEM 16GB,,Allow Refund,One per quote line,,,,Quantity,One-Time,true,,,,,,Disabled,,,,false,,false,,,1.0,false,,false,false,false,false,,false,false,false,false,true,false,false,false,Tabs,Click,false,false,false,List,,true,,false,,,,,Hardware,,Fixed Price,,,,,,,,,,,
Occupying 1U of rack space, this sliding shelf provides ventilation, and easy access to severs.,,Hardware,7486ba31-ae44-4deb-86c8-24d91d8cd64e,true,Sliding Shelf 200lbs,BSSA-4300,,Allow Refund,One per quote line,,,,Quantity,One-Time,true,,,,,,Disabled,,,,false,,false,,,1.0,false,,false,false,false,false,,false,false,false,false,true,false,false,false,Tabs,Click,false,false,false,List,,true,,false,,,,List,Hardware,,,,,One-time,,,,,,,,
Perpetual license for one (1) Finance and Reporting user.,,Software,4b253302-42e4-4245-b4ca-4f0405665d98,true,TE Suite Perpetual Finance and Reporting License,S-TE-FR,,Allow Refund,One per quote line,,,,Quantity,One-Time,false,,,,,,,,,,false,,false,,,1.0,false,,false,false,false,false,,false,false,false,false,true,false,false,false,,Click,false,false,false,List,,true,,false,,,,List,Software,,,,,Renewable,,false,,,,,,
MaxShell cooling, power distribution, and cable management products work seamlessly with IT enclosures to provide a complete infrastructure support system.  Holds 6 rack units (U's) for a vertical storage rack.,,Hardware,ea4020ce-9516-4afe-ba75-88739a11d288,true,MaxShell 6U 600mmx870mm,BMX-1051,,Allow Refund,One per quote line,,,,Quantity,One-Time,true,,,,,,Disabled,,,,false,,false,,,1.0,false,,false,false,false,false,,false,false,false,false,true,false,false,false,Tabs,Click,false,false,false,List,,true,,false,,,,List,Hardware,,,,,One-time,,,,,,,,
Occupying 1U of rack space, this shelf provides ventilation, 4-post mounting and an adjustable mounting depth.,,Hardware,4ec32338-d0a4-4a4b-b46a-07b00dff8124,true,Fixed Shelf 250lbs,BSSA-4302,,Allow Refund,One per quote line,,,,Quantity,One-Time,true,,,,,,Disabled,,,,false,,false,,,1.0,false,,false,false,false,false,,false,false,false,false,true,false,false,false,Tabs,Click,false,false,false,List,,true,,false,,,,List,Hardware,,,,,One-time,,,,,,,,
The 19-inch Black Modular Toolless Blanking Panel allows for quick and easy installation in any EIA-310-D compliant square hole mounting rail rack or enclosure.,,Hardware,1533dc9e-b5f9-49f1-8104-12a35d41bbb4,true,Black Toolless Airlow Mangment Blanking Panel,BSSA-4298,,Allow Refund,One per quote line,,,,Quantity,One-Time,true,,,,,,Disabled,,,,false,,false,,,1.0,false,,false,false,false,false,,false,false,false,false,true,false,false,false,Tabs,Click,false,false,false,List,,true,,false,,,,List,Hardware,,,,,One-time,,false,,,,,,
Basic Rack Power Distribution Unit allows users to distribute power outlets to rack-mount equipment.,,Hardware,87a2d6e6-b6d6-4ddb-b754-44059284a522,true,Rack PDU 20A, 120V L5-20 input 5-20 output,PDU-2022,,Allow Refund,One per quote line,,,,Quantity,One-Time,true,,,,,,Disabled,,,,false,,false,,,1.0,false,,false,false,false,false,,false,false,false,false,true,false,false,false,Tabs,Click,false,false,false,List,,true,,,,,,List,Hardware,,,,,One-time,,false,,,,,,
Basic Rack Power Distribution Unit allows users to distribute power outlets to rack-mount equipment.,,Hardware,d997ce1c-e73b-4265-b4a5-ed63512b09f3,true,Rack PDU 30A, 120V L5-20 input 5-20 output,PDU-2023,,Allow Refund,One per quote line,,,,Quantity,One-Time,true,,,,,,Disabled,,,,false,,false,,,1.0,false,,false,false,false,false,,false,false,false,false,true,false,false,false,Tabs,Click,false,false,false,List,,true,,,,,,List,Hardware,,,,,One-time,,false,,,,,,
Basic Rack Power Distribution Unit allows users to distribute power outlets to rack-mount equipment.,,Hardware,c4fa0583-44bc-4180-91be-7326d7c11cdf,true,Rack PDU 15A, 120V L5-20 input 5-20 output,PDU-2024,,Allow Refund,One per quote line,,,,Quantity,One-Time,true,,,,,,Disabled,,,,false,,false,,,1.0,false,,false,false,false,false,,false,false,false,false,true,false,false,false,Tabs,Click,false,false,false,List,,true,,,,,,List,Hardware,,,,,One-time,,false,,,,,,
The 12' Power Cord is designed to provide ideal electrical connectivity to your equipments. It operates at 250-Volt voltage range.,,Hardware,00df2d45-787c-4ec7-8ab0-18e52371cc10,true,L5-20 Input Power Cable 12',CMPC-5891,,Allow Refund,One per quote line,,,,Quantity,One-Time,true,,,,,,Disabled,,,,false,,false,,,1.0,false,,false,false,false,false,,false,false,false,false,true,false,false,false,Tabs,Click,false,false,false,List,,true,,false,,,,List,Hardware,,,,,One-time,,false,,,,,,
The 8' Power Cord is designed to provide ideal electrical connectivity to your equipments. It operates at 250-Volt voltage range.,,Hardware,5ab067a0-c904-4979-94db-39fd8d0d94fb,true,L5-20 Input Power Cable 8',CMPC-5892,,Allow Refund,One per quote line,,,,Quantity,One-Time,true,,,,,,Disabled,,,,false,,false,,,1.0,false,,false,false,false,false,,false,false,false,false,true,false,false,false,Tabs,Click,false,false,false,List,,true,,false,,,,List,Hardware,,,,,One-time,,false,,,,,,
These accessories offer the proper cable management options to meet varying needs.,,Hardware,f64fb1d3-77dc-4fbf-871b-a4c8ff2c648c,true,Vertical Cable Organizer, 8 Cable Rings,CMPC-5882,,Allow Refund,One per quote line,,,,Quantity,One-Time,true,,,,,,Disabled,,,,false,,false,,,1.0,false,,false,false,false,false,,false,false,false,false,true,false,false,false,Tabs,Click,false,false,false,List,,true,,,,,,List,Hardware,,,,,One-time,,false,,,,,,
Mounting hardware includes light and heavy-duty shelves, bolt-down brackets, stabilization plates, grounding kits, keyboard drawers, mounting rails, brackets, and associated hardware.,,Hardware,27dc27d4-e6de-46e0-9eb1-fb3e99b69dbb,true,Maxspace TX Bolt-Down Kit,BSSA-4304,,Allow Refund,One per quote line,,,,Quantity,One-Time,true,,,,,,Disabled,,,,false,,false,,,1.0,false,,false,false,false,false,,false,false,false,false,true,false,false,false,Tabs,Click,false,,false,List,,true,,false,,,,List,Hardware,,,,,,,false,,,,,,
vSphere Standard provides an entry solution for basic consolidation of applications to slash hardware costs while accelerating application deployment.,,Software,735daf80-536f-47aa-95ca-4b3ea25544ed,true,vSphere Standard,VMW-S,,Allow Refund,One per quote line,,,,Quantity,One-Time,true,,,,,,Disabled,,,,false,,false,,,1.0,false,,false,false,false,false,,false,false,false,false,true,false,false,false,Tabs,Click,false,false,false,List,,true,,false,,,,List,Software,,,,,Renewable,,false,,,,,,
Designed for software defined infrastructure supercharged for efficiency, performance, and agile services delivery across cloud-native and traditional applications.,,Hardware,1460b329-4bcd-4182-9fe4-27e42e156e84,true,Intel Xeon E5-2683 v4 2.1GHz,40M Cache,9.60GT/s QPI,Turbo,HT,16C/32T (120W),INTEL E5-2683,,Allow Refund,One per quote line,,,,Quantity,One-Time,true,,,,,,Disabled,,,,false,,false,,,1.0,false,,false,false,false,false,,false,false,false,false,true,false,false,false,Tabs,Click,false,,false,List,,true,,false,,,,List,Hardware,,,,,,,false,,,,,,
Industry-leading rotational vibration tolerance design helps ensure consistent performance in dense multi-drive systems,,Hardware,ea4d7854-ce4b-4fe5-b7ea-09bf6964df78,true,8TB 7.2k RPM NLSAS 12Gps 3.5 in,HD 8TB,,Allow Refund,One per quote line,,,,Quantity,One-Time,true,,,,,,Disabled,,,,false,,false,,,1.0,false,,false,false,false,false,,false,false,false,false,true,false,false,false,Tabs,Click,false,false,false,List,,true,,false,,,,List,Hardware,,,,,One-time,,false,,,,,,
Mounting hardware includes light and heavy-duty shelves, bolt-down brackets, stabilization plates, grounding kits, keyboard drawers, mounting rails, brackets, and associated hardware.,,Hardware,51a23802-e8be-45a1-b1f3-433d262bd0ef,true,Maxspace TX 600mm/750mm Stabalizer Plate,BSSA-4303,,Allow Refund,One per quote line,,,,Quantity,One-Time,true,,,,,,Disabled,,,,false,,false,,,1.0,false,,false,false,false,false,,false,false,false,false,true,false,false,false,Tabs,Click,false,,false,List,,true,,false,,,,List,Hardware,,,,,,,false,,,,,,
vSphere Desktop can be used to power virtual desktops, as well as the underlying infrastructure for the VDI environment.,,Software,0992af40-dc54-4e6b-821b-20cfbbbface7,true,vSphere Desktop,VMW-D,,Allow Refund,One per quote line,,,,Quantity,One-Time,true,,,,,,Disabled,,,,false,,false,,,1.0,false,,false,false,false,false,,false,false,false,false,true,false,false,false,Tabs,Click,false,false,false,List,,true,,,,,,List,Software,,,,,Renewable,,false,,,,,,
Experience enterprise-class features in the rack-optimized Dell PowerEdge Intel Xeon processor server ideal for your core business applications.,,Hardware,607d0404-e5eb-4380-91fd-19f8baadf800,true,Dell PowerEdge Server Pro,H-SVR-DELL,,Allow Refund,One per quote line,,,,Quantity,One-Time,false,,Always,,,,Required,,,,false,,false,,,1.0,false,,false,false,false,false,,false,false,false,false,false,false,false,false,Sections,Click,false,false,true,List,,true,,false,,,,List,,,,,,Renewable,,false,,,,,,
Basic Rack Power Distribution Unit allows users to distribute power outlets to rack-mount equipment.,,Hardware,4922bd8f-44e7-4e24-96cb-ea162fea53e4,true,Rack PDU 10A 230V C20 input C19 output,PDU-2026,,Allow Refund,One per quote line,,,,Quantity,One-Time,true,,,,,,Disabled,,,,false,,false,,,1.0,false,,false,false,false,false,,false,false,false,false,true,false,false,false,Tabs,Click,false,false,false,List,,true,,false,,,,List,Hardware,,,,,One-time,,false,,,,,,
The Power Cord is designed to provide ideal electrical connectivity to your equipments. It operates at 250-Volt voltage range.,,Hardware,06612474-f42d-4a39-bb7b-b557af5bdd25,true,C19 to C20 Power Cable 3',CMPC-5889,,Allow Refund,One per quote line,,,,Quantity,One-Time,true,,,,,,Disabled,,,,false,,false,,,1.0,false,,false,false,false,false,,false,false,false,false,true,false,false,false,Tabs,Click,false,false,false,List,,true,,false,,,,List,Hardware,,,,,One-time,,false,,,,,,
Windows Server 2012 R2 brings our experience delivering global-scale cloud services into your infrastructure,,Software,f05afbb2-f12f-4eab-a939-5e194076e815,true,Windows Server R2 2012,WIN S2012,,Allow Refund,One per quote line,,,,Quantity,One-Time,true,,,,,,Disabled,,,,false,,false,,,1.0,false,,false,false,false,false,,false,false,false,false,true,false,false,false,Tabs,Click,false,false,false,List,,true,,false,,,,List,Software,,,,,Renewable,,false,,,,,,
Our certified Module Extension Engineers specialize in configuring and customizing the additional modules to a client's specifications, and work closely with the Core System Engineers.,,Services,2dca1135-ffdf-4ac0-a187-b55788c4cb49,true,Module Extension Engineer,SV-MEE,,Allow Refund,,,,,Quantity,One-Time,true,,,,,,,,,,false,,false,,,1.0,false,,false,false,false,false,,false,false,false,false,false,false,true,false,,Click,false,false,false,List,,true,,,,,,List,,,,,,Renewable,,false,,,,,,
These accessories offer the proper cable management options to meet varying needs.,,Hardware,11472def-c81a-47cb-a459-b28a71e2986c,true,Tooless Cable Management Rings (Qty 10),CMPC-5881,,Allow Refund,One per quote line,,,,Quantity,One-Time,true,,,,,,Disabled,,,,false,,false,,,1.0,false,,false,false,false,false,,false,false,false,false,true,false,false,false,Tabs,Click,false,false,false,List,,true,,false,,,,List,Hardware,,,,,One-time,,false,,,,,,
