Roof Fan Tray promotes bottom to top airflow for an enclosure in zero U of space. It cools by exhausting heat out of the roof of the rack.,,Hardware,3728a4c1-3d2d-47dc-bf62-64ab6492b523,true,Roof Fan Tray 750mm - 208V,BSSA-4308,,Allow Refund,One per quote line,,,,Quantity,One-Time,true,,,,,,Disabled,,,,false,,false,,,1.0,false,,false,false,false,false,,false,false,false,false,true,false,false,false,Tabs,Click,false,false,false,List,,true,,false,,,,List,Hardware,,,,,One-time,,false,,,,,,
Installation and Assembly by a Infinity Solution Certified techniction,,Services,58889c65-5e7b-4dda-9d84-fc6e1a5b7802,true,Installation and Assembly of a Maxspace Rack,INST-1000,,Allow Refund,,,,,Quantity,One-Time,true,,,,,,Disabled,,,,false,,false,,,1.0,false,,false,false,false,false,,false,false,false,false,false,false,false,false,Tabs,Click,false,true,false,List,,true,,false,,,,List,,,,,,Renewable,,false,,,,,,
Basic Consulting package for implementation managed by 3rd party SI/Partner on Fixed Fee basis.,,Services,c84aed14-0436-42a7-8379-98ce6c541522,true,Quick Start Enablement,SV-QSE,,Allow Refund,,,,,Quantity,One-Time,false,,,,,,,,,,false,,false,,,1.0,false,,false,false,false,false,,false,false,false,false,false,false,true,false,,Click,false,false,false,List,,true,,false,,,,List,,,,,,Renewable,,false,,,,,,
Implementation managed by in-house professional services with an agreed upon scope of work.,,Services,3d5e049d-de5f-4d37-8f05-4f9b1f8c1d8a,true,Professional Services Scope of Work,SV-SOW,,Allow Refund,,,,,Quantity,One-Time,false,,,,,,,,,,false,,false,,,1.0,false,,false,false,false,false,,false,false,false,false,false,false,true,false,,Click,false,true,false,List,,true,,false,,,,List,,,,,,Renewable,,false,,,,,,
vSphere Enterprise includes the full range of vSphere features for transforming datacenters into dramatically simplified cloud computing environments providing the next generation of flexible, reliable IT services.,,Software,fa8a2021-0ff6-4f58-90a1-9315deec13c7,true,vSphere Enterprise,VMW-E,,Allow Refund,One per quote line,,,,Quantity,One-Time,true,,,,,,Disabled,,,,false,,false,,,1.0,false,,false,false,false,false,,false,false,false,false,true,false,false,false,Tabs,Click,false,false,false,List,,true,,,,,,List,Software,,,,,Renewable,,false,,,,,,
,,Custom,57197355-a019-4be7-9456-0f9f2afd7193,true,Custom Product Request,CP-1110,,Allow Refund,One per quote line,,,,Quantity,One-Time,false,,,,,,,,,,true,,false,,,1.0,false,,false,false,false,false,,false,false,false,false,false,false,false,false,,Click,false,true,false,List,,true,,false,,,,List,,,,,,Renewable,,false,,,,,,
MaxShell cooling, power distribution, and cable management products work seamlessly with IT enclosures to provide a complete infrastructure support system.  Holds 10 rack units (U's) for a vertical storage rack.,,Hardware,6b3bb057-92d3-42e3-b981-55037d8508da,true,MaxShell 10U 600mmx1200mm,BMX-1053,,Allow Refund,One per quote line,,,,Quantity,One-Time,true,,,,,,Disabled,,,,false,,false,,,1.0,false,,false,false,false,false,,false,false,false,false,true,false,false,false,Tabs,Click,false,false,false,List,,true,,false,,,,List,Hardware,,,,,One-time,,,,,,,,
8GB RDIMM, 2133MT/s, Dual Rank, x8 Data Width,,Hardware,13d98ff1-742a-4e9a-a04f-da596c7e5019,true,8GB RDIMM, 2133MT/s,MEM 8GB,,Allow Refund,One per quote line,,,,Quantity,One-Time,true,,,,,,Disabled,,,,false,,false,,,1.0,false,,false,false,false,false,,false,false,false,false,true,false,false,false,Tabs,Click,false,false,false,List,,true,,false,,,,,Hardware,,,,,,,,,,,,,
Designed for software defined infrastructure supercharged for efficiency, performance, and agile services delivery across cloud-native and traditional applications.,,Hardware,62311e88-78c8-4c8a-a52a-80816bc6e324,true,Intel Xeon E5-2609 v4 1.7GHz,20M Cache,6.4GT/s QPI,Turbo,HT 8C/8T (85W),INTEL E5-2609,,Allow Refund,One per quote line,,,,Quantity,One-Time,true,,,,,,Disabled,,,,false,,false,,,1.0,false,,false,false,false,false,,false,false,false,false,true,false,false,false,Tabs,Click,false,false,,List,,true,,false,,,,List,Hardware,,,,,,,false,,,,,,
Performing like any other hard drive, with the encryption being completely transparent or invisible to the user.,,Hardware,28b5d96b-b16a-4577-9292-3346f9df2ab4,true,8TB 7.2k RPM Self-Encrypting NLSAS 12Gps 3.5 in,HD 8TBSE,,Allow Refund,One per quote line,,,,Quantity,One-Time,true,,,,,,Disabled,,,,false,,false,,,1.0,false,,false,false,false,false,,false,false,false,false,true,false,false,false,Tabs,Click,false,false,false,List,,true,,,,,,List,Hardware,,,,,One-time,,false,,,,,,
Basic Rack Power Distribution Unit allows users to distribute power outlets to rack-mount equipment.,,Hardware,b4a928a1-b577-4db6-a9c8-ec1d1de47f06,true,Rack PDU 14.4kW, 208V, 3 phase CS8365 input C13 output,PDU-2028,,Allow Refund,One per quote line,,,,Quantity,One-Time,true,,,,,,Disabled,,,,false,,false,,,1.0,false,,false,false,false,false,,false,false,false,false,true,false,false,false,Tabs,Click,false,false,false,List,,true,,false,,,,List,Hardware,,,,,One-time,,,,,,,,
Basic Rack Power Distribution Unit allows users to distribute power outlets to rack-mount equipment.,,Hardware,4f71f41b-9f20-4f44-a70a-059d10bad749,true,Rack PDU 5.7W, 208V, 3 phase CS8365 input C13 output,PDU-2029,,Allow Refund,One per quote line,,,,Quantity,One-Time,true,,,,,,Disabled,,,,false,,false,,,1.0,false,,false,false,false,false,,false,false,false,false,true,false,false,false,Tabs,Click,false,false,false,List,,true,,false,,,,List,Hardware,,,,,One-time,,,,,,,,
The Power Cord is designed to provide ideal electrical connectivity to your equipments. It operates at 250-Volt voltage range.,,Hardware,c73a5a0d-4909-4500-b760-3f44c30a662f,true,C13 to C14 Power Cable 3',CMPC-5887,,Allow Refund,One per quote line,,,,Quantity,One-Time,true,,,,,,,,,,false,,false,,,1.0,false,,false,false,false,false,,false,false,false,false,true,false,false,false,,Click,false,false,false,List,,true,,false,,,,List,Hardware,,,,,One-time,,false,,,,,,
The Power Cord is designed to provide ideal electrical connectivity to your equipments. It operates at 250-Volt voltage range.,,Hardware,6d61898d-a311-47b1-8076-49db70414f26,true,C13 to C14 Power Cable 5',CMPC-5888,,Allow Refund,One per quote line,,,,Quantity,One-Time,true,,,,,,Disabled,,,,false,,false,,,1.0,false,,false,false,false,false,,false,false,false,false,true,false,false,false,Tabs,Click,false,false,false,List,,true,,false,,,,List,Hardware,,,,,One-time,,false,,,,,,
These accessories offer the proper cable management options to meet varying needs.,,Hardware,e1a680e5-617d-4015-b128-de8351d0b68c,true,Cable Containment Brackets,CMPC-5884,,Allow Refund,One per quote line,,,,Quantity,One-Time,true,,,,,,Disabled,,,,false,,false,,,1.0,false,,false,false,false,false,,false,false,false,false,true,false,false,false,Tabs,Click,false,false,false,List,,true,,false,,,,List,Hardware,,,,,One-time,,false,,,,,,
Basic Rack Power Distribution Unit allows users to distribute power outlets to rack-mount equipment.,,Hardware,96360ec2-3655-40ff-808c-828f81b27fb1,true,Rack PDU 20A, 230V C20 input C19 output,PDU-2025,,Allow Refund,One per quote line,,,,Quantity,One-Time,true,,,,,,Disabled,,,,false,,false,,,1.0,false,,false,false,false,false,,false,false,false,false,true,false,false,false,Tabs,Click,false,false,false,List,,true,,,,,,List,Hardware,,,,,One-time,,false,,,,,,
Windows Server Datacenter edition is designed for organizations with large workloads and heavily virtualized server environments.,,Software,302bf1ae-a05a-49b4-a201-7492e0805cc3,true,Windows Server Datacenter - Onetime License,WIN SDATA-OT,,Allow Refund,One per quote line,,,,Quantity,One-Time,true,,,,,,Disabled,,,,false,,false,,,1.0,false,,false,false,false,false,,false,false,false,false,true,false,false,false,Tabs,Click,false,false,false,List,,true,,false,,,,List,Software,,,,,Renewable,,false,,,,,,
Red Hat Enterprise Linux delivers military-grade security, 99.999% uptime, support for business-critical workloads.,,Software,4c2f7648-f741-4baa-9ae1-d538ea6b1a60,true,Red Hat Enterprise Linux,REDHAT,,Allow Refund,One per quote line,,,,Quantity,One-Time,true,,,,,,Disabled,,,,false,,false,,,1.0,false,,false,false,false,false,,false,false,false,false,true,false,false,false,Tabs,Click,false,false,false,List,,true,,false,,,,List,Software,,,,,Renewable,,,,,,,,
The Lenovo ThinkServer tower servers provide the performance, reliability and easy-to-use tools to power your file/print and point-of-sale workloads.,,Hardware,09827931-dfe0-4f1c-b21b-efd180501207,true,Lenovo ThinkServer,H-SVR-LENO,,Allow Refund,One per quote line,,,,Quantity,One-Time,false,,Always,,,,Required,,,,false,,false,,,1.0,false,,false,false,false,false,,false,false,false,false,false,false,false,false,Sections,Click,false,false,true,List,,true,,,,,,List,,,,,,Renewable,,false,,,,,,
Basic Rack Power Distribution Unit allows users to distribute power outlets to rack-mount equipment.,,Hardware,f5c7986e-6b09-4b7c-b2e5-bfac6fc8a0dc,true,Rack PDU 16A 230V C20 input C13 output,PDU-2027,,Allow Refund,One per quote line,,,,Quantity,One-Time,true,,,,,,Disabled,,,,false,,false,,,1.0,false,,false,false,false,false,,false,false,false,false,true,false,false,false,Tabs,Click,false,false,false,List,,true,,false,,,,List,Hardware,,,,,One-time,,false,,,,,,
The Power Cord is designed to provide ideal electrical connectivity to your equipments. It operates at 250-Volt voltage range.,,Hardware,dfac8899-8246-4185-9403-46ed420417b9,true,C19 to C20 Power Cable 5',CMPC-5890,,Allow Refund,One per quote line,,,,Quantity,One-Time,true,,,,,,Disabled,,,,false,,false,,,1.0,false,,false,false,false,false,,false,false,false,false,true,false,false,false,Tabs,Click,false,false,false,List,,true,,false,,,,List,Hardware,,,,,One-time,,false,,,,,,
Industry-leading rotational vibration tolerance design helps ensure consistent performance in dense multi-drive systems,,Hardware,d4b58f60-a8fd-4343-929f-daf0d3eb1d2f,true,1TB 7.2k RPM NLSAS 12Gps 3.5 in,HD 1TB,,Allow Refund,One per quote line,,,,Quantity,One-Time,true,,,,,,Disabled,,,,false,,false,,,1.0,false,,false,false,false,false,,false,false,false,false,true,false,false,false,Tabs,Click,false,false,false,List,,true,,false,,,,List,Hardware,,,,,One-time,,false,,,,,,
Subscription for one (1) Time and Expense user.,,Software,576f4351-caf1-4b3e-ae73-4262d76783eb,true,T&E Suite Time and Expense User License (Custom Segments),S-TE-USER-CUSTOM,,Default,One per quote line,,Monthly,Advance,Quantity,Recurring,false,,,,,,,,,,false,,false,,Standard,1.0,false,,false,false,false,false,,false,false,false,false,false,false,false,false,,Click,false,false,false,List,,true,,false,,,,List,,,Fixed Price,,1.0,Renewable,,false,,,,,,
System maintenance, administration, and configuration performed by a certified technician. 15% of hardware.,,Services,9bf2d715-6296-4f5a-bfab-66dcffe5673a,true,Silver Hardware Maintenance,SUPP-1000,,,One per quote line,,Annual,Advance,Quantity,Recurring,true,,,,,,Disabled,,,,false,,false,,Standard,1.0,false,,false,true,false,false,,false,false,false,false,false,false,true,false,Tabs,Click,false,false,false,List,,true,,false,,,,Net,Hardware,,Percent Of Total,,12.0,Renewable,,,Line,,,,,
